{
  "surface": "takeaway_store",
  "channel": "uat",
  "package_id": "com.foodchainservice.takeaway.uat",
  "version_name": "1.1.0-uat.14",
  "version_code": 10113,
  "minimum_supported_version_code": 10113,
  "rollback_version_code": 10112,
  "apk_url": "https://uat-takeaway.foodchainservice.com/downloads/takeaway-store/foodchainservice-takeaway-store-1.1.0-uat.14.apk",
  "apk_sha256": "34eabc30c9ba6d7ddab37905c9ff3fa68f36adcd73bfde7d1558934428feacec",
  "published_at": "2026-10-10T18:03:00.292Z",
  "signature": "hYfHCz3vbJv7Q3wgIvPWjlSD4ASpE1lt+39bkEQIGIcY9KR5Pt9AM7+rLCNMvI6mKUNxA8LoJJySp4f1r3jWAA=="
}
