{
  "surface": "takeaway_store",
  "channel": "uat",
  "package_id": "com.foodchainservice.takeaway.uat",
  "version_name": "1.1.0-uat.13",
  "version_code": 10112,
  "minimum_supported_version_code": 10112,
  "rollback_version_code": 10111,
  "apk_url": "https://uat-takeaway.foodchainservice.com/downloads/takeaway-store/foodchainservice-takeaway-store-1.1.0-uat.13.apk",
  "apk_sha256": "1738d10b2e3edb913136d893fa150ce6bfaff7a7e1681310bac4fdcb6336f3f2",
  "published_at": "2026-10-10T17:01:41.302Z",
  "signature": "pgIv6lpn8gEYmbWZZzmrhybbach1jAxSXQ53NbcsmtSCNYb7TIk8uvbc+4mIW8QuTt/WU40uqjva/0B/abR/Bg=="
}
